{
  "_description": "CONTAINMENT_GRADUATED event — agent transitions from L1 to L2 due to drift severity.",
  "protocol": "AIZP",
  "protocol_version": "V0.6",
  "wire_version": 2,
  "event": "CONTAINMENT_GRADUATED",
  "event_id": "b8c9d0e1-2345-4f01-8234-890abcdef012",
  "timestamp": "2026-05-19T10:08:00Z",
  "agent_id": "agent_alpha",
  "session_id": "sess_42",
  "payload": {
    "previous_level": "L1",
    "new_level": "L2",
    "scope": "AGENT",
    "trigger_event_id": "f6a7b8c9-0123-4def-b012-67890abcdef0",
    "reason": "drift_severity_exceeded_threshold_HIGH_COMPOSITIONAL_DRIFT",
    "active_restrictions": [
      "tools_sandboxed",
      "network_egress_blocked",
      "memory_writes_quarantined",
      "external_api_approval_required"
    ],
    "auto_release_conditions": [
      "gravity_score >= 0.80 for 5 consecutive checks",
      "operator_approval_received"
    ]
  }
}
